{
  "schema_version": 2,
  "work_id": "<work-id>",
  "task": "<user task>",
  "current_state": "initialized",
  "created_at": "<ISO-8601 timestamp>",
  "updated_at": "<ISO-8601 timestamp>",
  "timeout_at": "<ISO-8601 timestamp>",
  "owner": "claude",
  "mode": "full",
  "resume": {
    "detected": false,
    "last_session_id": null,
    "detected_at": null,
    "branch_validated": false,
    "rebase_performed": false
  },
  "budget": {
    "iteration_budget": 10,
    "budget_remaining": 10,
    "cost_budget_usd": 3.0,
    "cost_used": 0.0
  },
  "counters": {
    "fast_iter": 0,
    "design_iter": 0,
    "code_iter": 0,
    "panel_runs": 0,
    "merge_iter": 0,
    "approval_iter": 0,
    "self_review_iter": 0,
    "test_adequacy_iter": 0,
    "subagent_spawns": 0
  },
  "ambiguity": {
    "detected": false,
    "notes": [],
    "resolved": false
  },
  "approvals": {
    "pr_approved": false,
    "changes_requested": false
  },
  "metrics": {
    "tests_passed": false
  },
  "risk": {
    "level": "unknown",
    "score": null,
    "top_items": []
  },
  "artifacts": {
    "feasibility": null,
    "ambiguity-report": null,
    "fast-path-check": null,
    "design": null,
    "design-review": null,
    "design-feedback": null,
    "design-panel-review": null,
    "verification-results": null,
    "test-stubs": null,
    "test-results": null,
    "implementation": null,
    "self-review": null,
    "reflection-log": null,
    "review-feedback": null,
    "review-pass": null,
    "permissions-changes": null,
    "validation-results": null,
    "cicd": null,
    "pr-link": null,
    "approval-feedback": null
  },
  "validation": {
    "structural_passed": false,
    "quality_passed": false,
    "last_checked_at": null,
    "notes": []
  },
  "git": {
    "base_branch": null,
    "working_branch": null,
    "remote": "origin",
    "pr_url": null,
    "merge_sha": null,
    "merge_strategy": null
  },
  "pipeline": {
    "complexity_score": null,
    "fast_path_eligible": false,
    "fast_path_decision": null,
    "design_review_status": null,
    "review_status": null,
    "verification_status": null,
    "permissions_status": null,
    "validation_status": null,
    "self_review_status": null,
    "pr_status": null,
    "subagent_auto_select": true,
    "subagent_mode": null,
    "subagent_selections": [],
    "tdd_mode": false,
    "worktree_path": null
  },
  "convergence": {
    "last_failure_category": null,
    "consecutive_same_category": 0
  },
  "history": []
}
